text,label
"NET team at Microsoft, to get more details. InfoQ: What are the motivations behind the ASP.NET WebHooks project? There are really two",microsoft
"Microsoft quietly released a new short cartoon today, discussing the science behind its ",microsoft
Activist investor ValueAct Holdings said it sold about 25 percent of its stake in Microsoft after an increase in the stock caused its portfolio to be,microsoft
Kota Kinabalu: The biochemical sector is the biggest potential in bio-economy for Sabah to go forward and complement the government's mission to be a high income developed nation by 2020. ,economy
"""""""My favorite character is probably""""""the dwarf, what's his name?"""""" Obama said in the GQ interview. """"""The problem with Game of Thrones""""""is that I",obama
"President Barack Obama sharply criticized Republicans Wednesday for suggesting that Syrian refugees coming to the United States posed a security threat, blasting some GOP suggestions as &quot;offensive&quot; and mocking what he said was a fear of &quot;widows and o ",obama
"Microsoft said it would offer European customers the option of storing their cloud data in Germany, addressing concerns about the security of U.S. data centers following reports of surveillance by intelligence agencies. ",microsoft
"The story brings to mind what I wrote in this post on the Microsoft case: If I'm reading the Magistrate Judge's opinion correctly, you're always",microsoft
"The Coldspring-Oakhurst Lady Trojans fell to the Palestine Lady Cats on the Trojans' home court, Dec. 1, by 60-53, but the Lady Trojans kept",palestine
"UNITED NATIONS: Prime Minister Narendra Modi hopes that talks between Israel and the Palestinian Authority will resume soon, leading to a",palestine
"Microsoft has moved to dispel European mistrust of U.S.-operated cloud services by announcing a plan to offer cloud services, including Azure,",microsoft
"THE THAI economy and the information technology sector will benefit from the awarding of new 4G telecom licences as early as next year as the bid winners will quickly implement their investment plans, according to Supant Mongkolsuthree, chairman of Federation of Thai Industries. ",economy
"The PBO slashed in half its forecast for Canada's economy for 2015, and now expects the economy to grow a meagre 1.1 per cent this year,",economy
" on Tuesday is relatively cold, cloudy and rainy as temperatures further drop, according to the Palestinian Meteorological Department.",palestine
"Palestine Solidarity Campaign (PSC), whose patrons also include the Oscar winning actress Julie Christie and the playwright Caryl Churchill,",palestine
"In the wake of the Paris attacks, President Obama said Monday he will stick with the current U.S. strategy against ISIS. Speaking at the G20 summit in Turkey, Obama reiterated that the goal is to “degrade and destroy” the terrorist group. “Even as we grieve with our French friends … we can’t lose sight that… ",obama
"US President Barack Obama on Wednesday demanded China end artificial island building in the hotly contested South China Sea, upping the pressure on Beijing at a regional leaders’ summit. The annual Asia-Pacific Economic Co-operation (APEC) gathering is meant to forge … Read more » ",obama
"The Israeli move comes amidst escalating tension in occupied Palestine, and a large number of videos, including those showing Israeli soldiers",palestine
TOKYO (Reuters) - Confidence among Japanese manufacturers fell in November for a third straight month to levels unseen in about 2-1/2,economy
Microsoft now appears to have Apple in its sights in what demonstrates a more focused advertising strategy. ,microsoft
"Israeli commentators Yaron Friedman of Ynet News and Haviv Rettig Gur, of the Times of Israel are clueless about the driving force behind the",palestine
"Learn about the different business models that have propelled Apple, Google and Microsoft to be the most valuable companies in the world. ",microsoft
"Growth in the 19-nation eurozone slowed to 0.3 percent in the third quarter, official data showed on Friday, with the economy in powerhouse Germany cooling as France returned to expansion. The quarterly growth was below the analyst estimate of 0.4 percent for the period and will fuel speculation the European Central Bank will expand its vast stimulus programme next month. The Eurostat agency ",economy
"According to the Times of Israel, Shwartz and a Palestinian man were declared dead at the scene in the incident that killed three total and",palestine
"Barack Obama has spent the last seven years making good on his promise to """"""fundamentally transform"""""" our nation. The problem is that the",obama
"Finland is used to cold, dark winters, and the experience could stand it in good stead as the Nordic country's bitter economic cold snap shows",economy
Economists believe economic growth has been much stronger since the middle of this year after a weak June quarter. A survey of economists,economy
Microsoft is expected to begin rolling out the NXOE beginning today to Xbox One owners. And while many elements of the Xbox Experience,microsoft
Economists are awaiting Thursday's Job Openings and Labor Turnover Survey to see if the rate of people quitting their jobs for something,economy
"Findings from The Design Economy Report, a new study conducted by the UK's Design Council. All images and graphics via the Design Council. Researchers and urban planners constantly promote the creative economy as a valuable catalyst for community development ",economy
"Here's what's inside Microsoft's $3,000 HoloLens developer kits, which start shipping on March 30. ",microsoft
President Barack Obama is doubling down on his strategy to combat Islamic State in the face of rising calls from domestic allies and critics alike for a more aggressive campaign against the extremist group. ,obama
"Many Microsoft fans queued excitedly for hours to get a first look in the new Sydney store, which is the first to open outside of North America. ",microsoft
Microsoft really wants you to use OneNote. The OneNote app for Android now has a button that hovers over your screen and is a lot like,microsoft
Microsoft may soon be one of the first cloud-computing companies in the United States to let Europeans store their online data closer to home. ,microsoft
"You're probably used to logging in to your Windows computer with a password. However, if you're using a Microsoft account to log in to",microsoft
An activist holds a placard during a protest rally in observance of the International Day of Solidarity with the Palestinian People in front of the,palestine
"The warning signs around global economic growth are growing, with Moody's, the influential ratings agency, adding its voice to a clamor of",economy
"Indonesia’s economy grew less than analysts estimated last quarter, underscoring the challenge for the government as it seeks to accelerate spending and bolster growth. ",economy
"Microsoft just announced a bunch of updates to Project Oxford, a set of online services that help developers build more intelligent apps with complicated features",microsoft
"President Barack Obama's hard road to fill a vacancy on the Supreme Court faces a pivotal week. Interest groups on the right and left are ramping up for a protracted fight, and the President will sit down with his Republican adversaries who have vowe ",obama
Microsoft CEO Satya Nadella was in Mumbai to give a keynote at the inaugural edition of 'Future Unleashed: Accelerating India' event which is,microsoft
"When Microsoft released the Surface Pro 4 and Surface Book devices on October 20, there were a lot of complaints. While the Surface Pro 4 had some bugs, such as screen flickering problems caused by a faulty display driver, some considered the Surface Book practically unusable. Just days after the release of the Surface Book, Read more » Microsoft Fixes Most Surface Book And Surface Pro 4 Bugs ",microsoft
New information has been released about a robbery seen from Dallas to Arkansas.  New footage from Palestine’s prosperity Bank shows a large forklift ripping out the ATM from a drive-thru lane.  ,palestine
"IDF forces raid the highly popular Al Hurriya radio station in Hebron overnight, issuing a six-month closure order for the station, which according",palestine
"Nearly every night for the past four years, Vincent Wu has been tuning into a video-streaming site called YY.com that hosts live performances of",economy
"11, Republican presidential candidate Jeb Bush told a very detailed and specific story to underscore Democratic President Barack Obama's",obama
"Microsoft's New Xbox One Experience is coming to gamers on Nov. 12, with one of the more anticipated additions to the gaming console being",microsoft
"In July 2014, Microsoft CEO Satya Nadella announced the company would be &quot;streamlining&quot; operations with the news that 18,000 jobs would",microsoft
"Jessie J brought her razor sharp new hairstyle to the Microsoft store opening in Sydney last night. The British pop queen, who jetted in to",microsoft
The eurozone's economy lost steam in the latest quarter as Portugal to inject further funds into the eurozone economy to maintain recovery.,economy
"Michael J. Uccellini, president at CEO of Troy-based United Group of Companies and president of Chapter 93 of the Institute of Real Estate",economy
onenote-audio-ios.png (Image: Microsoft) Microsoft software helps make my Apple iPhone 6s Plus a great business phone. One of the key apps,microsoft
"Analysis: Israel and Palestine have come to an agreement on building a 3G mobile network, in what may be part of a peace quartet initiative. ",palestine
UBS U.S. equities and derivatives strategist Julian Emanuel and BlackRock global chief investment strategist Russ Koesterich discuss the,economy
Palestinian President Mahmoud Abbas could not have anticipated how quickly his threats to end cooperation with Israel would be tested after,palestine
"The Surface Book includes Microsoft's latest version of the Surface Pen, while Apple will sell its &quot;Pencil&quot; separately.",microsoft
"Israel's economy minister, who has been holding up a government plan that fast-tracks the development of huge natural gas deposits offshore Israel, will step down on Sunday in a move likely to give the industry a major boost. Prime Minister Benjamin Netanyahu now becomes the Minister of Economy and he said he will approve a deal reached in August with Texas-based Noble Energy and Israel's Delek ",economy
Read the letter from two former Secretaries of the Department of Homeland Security on welcoming refugees while ensuring the safety of,obama
"As part of its massive November update cycle, Microsoft on Thursday pushed a smorgasbord of new features to its OneNote notetaking",microsoft
"For much of the past seven years, President Obama has labored to move the United States off a war footing abroad and keep the threat of",obama
"RAMALLAH, West Bank """""" The Palestinian people were divided following President Mahmoud Abbas' speech at the United Nations General",palestine
"The Palestine Red Crescent Society acted with impartiality and professionalism in the case of the terror attack on a family driving in the West Bank that left two dead, its parent organization said. ",palestine
The Palestinian movement has reached a strategic impasse. Finding a way out requires coming to terms with the lessons of the last four,palestine
"He said the Chinese economy will only be sustainable once it is &quot;clean&quot; and &quot;transparent,&quot; and the next five to 15 years will be good times for",economy
US president Barack Obama explained same-sex marriage law to young leaders from Southeast Asia at a town hall session in Kuala Lumpur,obama
"A lot of analysts distrust Chinese economic data. China ease, and U.S. consumer spending helps the U.S. economy """""" and China's as well.",economy
"Although Microsoft is making great strides in unifying its console and PC platforms into a single ecosystem, not everyone is especially happy about the push to use the Windows Store to sell games. In particular, the way the games launch through the Store, rather than the .exe file, and the lack of V-sync, has irked customers. Fortunately Microsoft has now pledged to fix that issue, with the head ",microsoft
"Sen. Ted Cruz (R-TX) addressed President Obama directly while speaking to reporters Wednesday, telling him to &quot;come back and insult me to",obama
"Activity in China's manufacturing sector unexpectedly contracted in October for a third straight month, an official survey showed on Sunday, fuelling fears the economy may still be losing momentum in the fourth quarter despite a raft of stimulus measures. Adding to those concerns, China's services sector, which has been one of the few bright spots in the economy, also showed signs of cooling ",economy
President Obama on Tuesday vowed to work even more with allies like France to prevent further terrorist attacks from groups like the Islamic,obama
"Hongkong and Shanghai Banking Corp., one of the world’s largest banks, said Wednesday the Philippines will continue to outperform other Asian countries, with a gross domestic product growth of 5.5 percent this year. ",economy
Microsoft has become the latest and almost certainly th […] ,microsoft
A new trojan discovered by Palo Alto Networks uses security software installed on the user's computer to side-load DLLs needed to install itself.,microsoft
"Shaaban saluted Palestinian martyrs, struggling valiantly for War on Palestine is part of the plot against Syria, he stressed, ISIS and other",palestine
The Tennessee Colony Volunteer Fire Department is manning the road blocks for the Anderson County Sheriff's Office's crime scene of a,palestine
"CALGARY """""" The leader of one of the largest union groups in North America called U.S. President Barack Obama a """"""hypocrite"""""" for rejecting the",obama
"They told her about the Microsoft Software &amp; Systems Academy (MSSA), an intensive 16-week IT training program for soldiers leaving active",microsoft
The latest news from the U.N. climate conference that began Monday in Paris. All times local: ,palestine
"Like improvements to the Utah Jazz, Utah’s threshold economy has taken a lot of work and still requires fine-tuning ",economy
"President Obama reiterated his case Monday for his strategy against Islamic State and flatly rejected the idea that the U.S. should take dramatic new actions in the wake of the Paris attacks just to “look tough.” Speaking to reporters at the end of a global summit here, Obama dismissed calls that ",obama
WND RADIO. Christian army begs Obama for help crushing ISIS. 'We can face them without any fear. We can fight them if we have support'.,obama
"The Minnesota chapter of Students for Justice in Palestine, along with in the West Bank and Gaza, activists for Palestine on American college",palestine
"Our local community -- Jews, Muslims, Christians, and others committed to justice in Palestine -- spoke truth to power, and kept our grassroots",palestine
"PALESTINE, Texas (AP) — Six people were killed at a Texas campsite and a suspect has been arrested and charged in the weekend homicides, authorities said Monday. ",palestine
But it is perhaps the weaker demand prospects due in part to a slowing Chinese economy and fears over the economic impact of a potential US,economy
"Now, Microsoft MSFT 0.26% is adding service and support perks to make them an easier sell for big businesses. It now expects the latest",microsoft
"President Obama said on Sunday that the US and its international partners """"""will not relent"""""" in the fight against Islamic State and that the world",obama
President Obama discussed the global combat against Islamic State militants as the Association of Southeast Asian Nations (Asean),obama
U.S. President Barack Obama gestures while reacting to a question about U.S. politicians opposed to taking in Syrian refugees as he delivers,obama
"Capoeira 4 r""""fugi""""s, une organisation caritative bas""""e au Royaume-Uni qui met en """"uvre des projets en Syrie, en Palestine et en Jordanie,",palestine
"The eurozone economy can't achieve lift-off, it seems, despite a number of positive tail-winds. Official figures tomorrow are expected to show the si ",economy
"Sony continues to slowly increase its majority share, while Microsoft holds relatively steady and the Wii U slides quickly into market obscurity.",microsoft
"President Obama is sending a clear message to the world that he will travel to the climate change summit in Paris next week, describing the",obama
"Cybercrime is costing the Northern Ireland economy almost £100m a year, claims an accountancy firm. ",economy
[publication|646288]'One Card' in Palestine is an example of how WFP is creating meaningful partnerships. More and more governments and,palestine
The nation was forced to endure yet more pious prattling from President Obama this week who spent time berating Americans who are worried,obama
The opening of the Panama Canal locks is just one likely event in what promises to be an eventful year for the global economy.,economy
"The US economy cooled in the third quarter but underlying consumer demand remains strong as the Federal Reserve considers its first interest rate hike in nine years. In a positive sign, third-quarter growth mainly reflected solid consumer spending, which accounts for two-thirds of US output, as consumers found themselves with a lot more disposable income than in the second quarter. Consumer ",economy
"The moms of New Palestine High School football players know that feeling well, they say. The excitement, the tension and """""" win or lose """""" the",palestine
Microsoft's Future Decoded event starts Tuesday November 10th at the ExCel centre in London. Here are some of the key things to expect.,microsoft
"LONDON - The eurozone economy lost momentum in the third quarter, official figures showed Friday — a development that puts further pressure on the European Central Bank to stimulate growth more. ",economy
"On Tuesday, he will make his case in Washington to President Obama and then travel to Moscow with the same message for President",obama
"Microsoft announced that it will open new data centers in Germany in late 2016, in a bid to protect consumers' digital information from U.S",microsoft
"By Jim Acosta CNN KUALA LUMPUR, Malaysia (CNN) — This was not the overseas trip to Turkey and Asia that the White House had in mind. Instead of focusing primarily on his “pivot to Asia,” as his top aides planned, President Barack Obama spent much of this past week grappling with a mushrooming terrorist threat […] ",obama
"Meanwhile, Barack Obama, titular head of the free world, has responded to Paris with weariness and annoyance. His news conference in",obama
All of the economies of the region are oil importers and benefit from Kaczor said the GDP data did not indicate the economy was in need of,economy
The economy may be recovering but the president of the National Urban League says it's leaving too many neighborhoods behind. ,economy
"Russia, having challenged the current international political order, now faces sanctions. China, the greatest rising economic counterweight, has",economy
"Members of the National Women's Studies Association have voted to endorse the Palestinian call for boycott, divestment and sanctions (BDS)",palestine
"When it comes to US intelligence failures on ISIS, it turns out President Obama's dismissing the Islamic State as a """"""JV team"""""" was only a minor",obama
"The Russian economy took another slide in the third quarter, shrinking by 4.1% compared to the same period last year. ",economy
"Growth in the 19-nation eurozone slowed to 0.3 percent in the third quarter, official data showed on Friday, with the economy in powerhouse Germany cooling as France returned to expansion. The quarterly growth was below the analyst estimate of 0.4 percent for the period and will fuel speculation the European Central Bank will expand its vast stimulus programme next month. The Eurostat agency ",economy
"ARUNDEL woman Anne Alidina visited the Holyland in October 2013 and found inspiration from a nation battling injustice, which ignited a passion for Palestine and its people. ",palestine
"With California's economy on the rebound, the state's voters are slightly more upbeat than voters nationwide about their potential for a",economy
"RAMALLAH, (AA) """""" At least 700 Palestinian children between the ages of 11 and 17 have been arrested by the Israeli army this year, with more",palestine
Innovation in the Emerald City is being stoked by big names like Microsoft and Amazon. That's good news for entrepreneurs. ,microsoft
"Comment: The United Nations makes up ways to 'remember' Palestinian rights, while undermining them at every step, writes Ramona Wadi. ",palestine
"ANTALYA, Turkey (AP) — President Barack Obama on Monday conceded that the Paris terror attacks were a &quot;terrible and sickening setback&quot; in the fight against the Islamic State, but forcefully dismissed critics who have called for the U.S. to change or expand its military campaign against the extremists. ",obama
Microsoft is planning to launch its Lumia 950 and Lumia 950 XL handsets on November 20th. Windows Central reports that the Lumia 950 will,microsoft
"The """"""Gig Economy,"""""" or the on-demand """"""sharing"""""" economy, provides so many new ways for consumers to obtain the services they need, while",economy
"Washington's metro residents rate first in the nation: 50% of them have a bachelor's degree or higher. By generating higher incomes and,",economy
"Attkisson said, """"""I have talked to people who have worked in the Obama administration who firmly believe he has made up his mind. I would say",obama
"Microsoft will launch a fleet of data centres and a dedicated Azure cloud Future Decoded event in London, Microsoft CEO Satya Nadella said",microsoft
"Benchmarks indicate that it's not just faster than low end generic PCs, but also faster """""" and less expensive """""" than Microsoft's Surface Pro 4.",microsoft
"Analysis Microsoft stubbornly refuses to let go of making hardware, but now the reasons why CEO Satya Nadella has not followed his clear",microsoft
"In the Philippines for an Asia-Pacific Economic Cooperation summit, President Obama urged China to halt military activities on the disputed islands. ",obama
"MADA, the Palestinian center for development and media freedoms, on Sunday extremely condemned the closure of Dream Radio i n Hebron",palestine
"COP Debate Bush Rubio Fox Business Network, which is partnering with the Wall Street Journal on tonight's debate, promised it won't be a",economy
Secretary of State John Kerry is in Israel for talks with Israeli and Palestinian officials on ways to curb spiraling violence and restore security.,palestine
"Joe Scarborough blasted Barack Obama on Monday, insisting """"""he's radically out of step with where the American people are, where our allies",obama
"Hours after President Obama touched down in Manila on Tuesday, he toured a refurbished former U.S. frigate that is now the flagship of the Philippine navy and announced plans to give two more ships and other aid to Manila to help it patrol disputed islands in the South China Sea.Emerging from the ",obama
"Microsoft built a satellite imagery tool in 1990s only to dump it. This was revealed by Tom Barclay from Microsoft. As it happens, Microsoft built a",microsoft
"Driven by surging manufacturing across North America, the London region is enjoying a &quot;smoking hot&quot; economy, said a national economist in",economy
"But Obama lashed out at Republicans who called for a freeze in migration from its territories. This was not only bigoted the president said, but",obama
"Layla White, of London Palestine Action which organised the sit-down protest at the crossing between Oxford Street and Regent Street, said:",palestine
Software interprets feelings such as anger and even surprise by analysing still images. ,microsoft
"President Obama might have a little election 2016 envy. In a wide-ranging interview with GQ Magazine, Obama, a term-limited incumbent with only 14 months left in office, said it “would’ve been fun” to campaign against GOP presidential frontrunner Donald Trump. The comments, published on Tuesday, are similar to those Democratic frontrunner Hillary Clinton has made in the past about hoping to face ",obama
Malcolm Turnbull says his first talks with Indonesia's President Joko Widodo will centre on their mutual interest in growing economic,economy
"India’s underground economy is booming, and Finance Minister Arun Jaitley wants to keep it that way. ",economy
"Obama calls on China to halt land reclamation, new construction in South China Sea ",obama
(Photo : Andrew Burton/Getty Images) Microsoft has confirmed that it is unable to stop Windows 10 from automatically spying on its users.,microsoft
The Surface Book has presented an interesting conundrum for PC makers who ,microsoft
"KUALA LUMPUR - US President Barack Obama on Saturday condemned what he called the &quot;appalling&quot; jihadist hostage seige in Mali that left at least 27 people dead, including an American citizen. &quot;This barbarity only stiffens our resolve to meet this challenge,&quot; he said during a visit to Malaysia, referring to the global threat of extremist violence. ",obama
" Weather on Saturday is partially cloudy, with no significant change in temperature, according to the Palestinian Meteorological Department.",palestine
A new market report from the analysts at Futuresource indicates that despite the momentum of ,microsoft
Microsoft's beta tool guesses people's emotions through facial recognition software. How does that make you feel? Guardian. 13 november,microsoft
