text,label
President Obama stands with Malaysian Prime Minister Najib Razak at the ASEAN Summit gala dinner in Kuala Lumpur on Nov. 21.,obama
This has been a year of magical thinking. ,palestine
"Australia’s central bank extended its interest-rate pause for a sixth month as evidence mounts that the economy is rebalancing away from mining, supported by past rate cuts and a weaker currency. ",economy
"France's economy returned to growth in the third quarter of this year, expanding by 0.3 percent, after having earlier stalled, the national statistics agency said Friday. The initial estimate of 0.3 percent quarter-on-quarter growth in gross domestic product in July to September followed no expansion in the second quarter, which had raised concerns about the nation's weak economic recovery ",economy
"ISTANBUL, Nov 9 (Reuters) - Turkey's economy could grow 4 percent or more in 2016 and expectations for the economy could improve if structural reforms are carried out, Finance Minister Mehmet Simsek said on Monday. Speaking to reporters in Istanbul, Simsek said political risk in Turkey had declined to a minimum level after the Nov. 1 election and he urged people not to believe &quot;gossip&quot; regarding ",economy
"Starting next year, the Windows 10 upgrade will be categorized as a &quot;Recommended Update.&quot; ",microsoft
"NABLUS, November 23, 2015 (WAFA) """""" Israeli forces Monday afternoon killed a Palestinian teenager following an alleged stabbing attempt at a major Nablus",palestine
"WASHINGTON — The U.S. economy has resembled an especially dizzying roller-coaster ride this year, with a hurtling dive followed by a steep climb leading to yet another slide. On Thursday, when the government ",economy
Johannesburg - Government's support for a free Palestine does not mean it is against the existence of the state of Israel and the safety of the,palestine
"Microsoft's Mike Ybarra: &quot;The reality was the usage was very, very low.&quot; ",microsoft
France's Macron sees economy growing between +1.1 and +1.2% in 2015. Tue 10 Nov 2015 07:11:38 GMT. Author: Mike Paterson | Category: News.,economy
"Opinion: in the ongoing Israel/Palestine conflict, the most mundane forms of architecture have become political and ideological battlegrounds,",palestine
Palestinian defender Abdallah Jaber (R) attempts to cross the ball past Malaysia's Wan Zack Haikal (C) during the WC2018 Asia Qualification football match between Palestine and Malaysia. ,palestine
"Microsoft's Edge is a fast, lightweight browser with good standards support and a few unique tools, but with no extension or syncing capabilities, it's not yet fully mature. ",microsoft
"Based on Acompli, which Microsoft had bought for over $200 million in December 2014, Outlook for iOS (and later Android) lacked things like",microsoft
"When Microsoft first introduced its Surface Book laptop last week, Surface exec Panos Panay made the bold claim that it was twice as fast as",microsoft
"FCC penalties totaling $100 million against carriers accused of fraud has yet to be collected, drawing attention from both Republican and",obama
"True enough, but neither should Mr. Obama's nave sentiment persuade anyone to abandon common sense or his life in a foolish surrender to",obama
A new web app from Microsoft offers to rate your moustache - and it will even give the follically challenged a helping hand. MyMousache.net is,microsoft
"As a rule of thumb, the state pays around 12,000 euros per refugee, estimates the German Institute for Economic Research (DIW) in Berlin.",economy
"President Obama, Hillary Clinton and other senior Democrats refuse to say America is at war with """"""radical Islamic terrorism"""""" for fear of insulting",obama
The need for united action against Isis is top of the agenda at the UN security council where France is to push for an effective declaration of war,obama
"This support is translated through opening borders for Palestinian refugees and students, hosting high-level officials from Palestine as well as",palestine
"Bio-Logic Aqua® Research Water Life Science® Founder Sharon Kleyne recently discussed water wars, ISIS, Syria, Israel-Palestine, fresh water policy and Water Life Science® on her Sharon Kleyne Hour® Power of Water® radio show of Monday, Nov. 30, 2015. (PRWeb December 04, 2015) Read the full story at http://www.prweb.com/releases/2015/12/prweb13113805.htm ",palestine
"What do Beyonc"""", Blue Ivy Carter, Gwyneth Paltrow, and Barack Obama all have in common, other than the fact that they've never waited for a",obama
"The event, which marked an international day of solidarity with Palestine, was organized by the group Palestinian and Jewish Unity, as well as",palestine
"U.S. President Barack Obama held firm that Syrian President Bashar al-Assad must be removed from office, saying that he doesn’t believe the civil war in Syria will end while the dictator remains in power. ",obama
A man has been formally charged with six counts of capital murder in the killing of a family at an East Texas campsite. ,palestine
"An Israeli soldier fires tear gas during clashes with Palestinian protesters in the Shu'fat refugee camp in East al-Quds (Jerusalem) on October 9,",palestine
"Microsoft on Monday announced that its HoloLens Development Edition was available for preorder, with units set to ship to developers beginning March 30. The company early last year introduced the holographic computer technology as a feature for Windows 10. It later announced a partnership with Volvo that would allow the application to be applied to the automobile sales floor. ",microsoft
"President Obama said Thursday that Syrian refugees are no more dangerous to the U.S. than tourists, and he accused Republican presidential candidates of stoking fears about the refugees and closing the Guantanamo Bay terrorist detention center to score political points. Speaking to reporters at a summit in the Philippines, Mr. ",obama
(MENAFN - Emirates News Agency (WAM)) New York 24th November 2015 (WAM) -- In a meeting commemorating the International Day of Solidarity with the Palestinian People to be obser ,palestine
&quot;Grow as the economy grows&quot; is apparently the notion Moodys has built its Pakistans banking system rating up gradation on from negative to stable. Not much has changed between now and September this year - when Moodys signalled how the interest rate cut would hurt profitability of Pakistani banks. ,economy
"U.S. President Barack Obama, who is attending a regional summit in Malaysia, has been briefed by his national security adviser on the",obama
"An arts campus that would provide space for craftspeople, artists and designers to create, test and market new products is still in the works for",economy
"Microsoft has announced that it has acquired Mobile Data Labs, the company behind MileIQ mile-tracking app. The terms of the deal were not disclosed, but the aim of the new acquisition is quite certain -- to improve the existing mobile productivity portfolio. San Francisco-based Mobile Data Labs developed the MileIQ app soon after its establishment by Dan Bomze and Chuck Dietrich in 2011. ",microsoft
Israel has been using Dutch dogs to terrorize Palestinian civilians - including children - and have been exporting them from the Netherlands for,palestine
US economy slowed to 1.5 pct. growth rate in July-Sept. quarter as businesses cut stockpiles ,economy
"Microsoft wants to make Mac users jealous with its new line of Windows 10 ads. The company uploaded a series of videos Sunday that focus on “the bug chicks,” two entemologists from Texas A&M University. With Windows Hello, Cortana and a touchscreen, the pair can design gorgeous presentations in rapid time. ",microsoft
Al-Armouti went on to urge the leaders of Arab and Islamic countries to &quot;defend the holy places [in Palestine] and the Palestinian people&quot;.,palestine
"The current wave of Palestinian attacks should receive """"""all kinds of support,"""""" Hezbollah leader Hassan Nasrallah said Friday, praising the",palestine
Six UK trade bodies have written a joint letter to EU Commission vice president Frans Timmermans underlining the need for &quot;pull measures&quot; to,economy
"Microsoft long ago got over its fear of open source software, although public perception has been slower to follow. But if there was any",microsoft
"WASHINGTON (AP) — President Barack Obama will huddle with the leaders of Germany, the United Kingdom, Italy and France next week in hopes of making &quot;incremental progress&quot; in the fight against the Islamic State group, the White House said Thursday. ",obama
"But Brookings experts are concerned in particular with the way major urban economies in the United States do business abroad, and on that",economy
Global trade and economic activity--held back by China in 2015--is expected to show a modest revival over the next two years. An employee,economy
The U.S. administration's slow and lukewarm reaction to the killing of Ezra Schwartz is a worrying sign for those who believe that all victims of,obama
"Sunday, 29th November 2015, is the first day of Advent as well as the International Day of Solidarity with the Palestinian People initiated by the",palestine
"Ministers have been talking up the economy, rising employment and shrinking debt over many months, encouraging people to believe that the",economy
"Microsoft OneDrive price hike could push consumers to cloud rivals Microsoft no longer plans to offer unlimited storage for Office 365 Home,",microsoft
"According to a tweet sent out by tipster @sleaknow, the rumored Microsoft Lumia 650 (code named Saana) could be the last 5-incher to carry",microsoft
"&quot;On this international day of solidarity, let us reaffirm our commitment to bring about the justice and peace that the people of Israel and Palestine",palestine
"[OSLO] Saudi Arabia, the world's largest crude oil exporter, plans to diversify its economy to help combat climate change in a move that could reduce expected carbon emissions by up to 130 million tonnes a year by 2030, the government said on Tuesday. ",economy
"North Korea's black economy becomes a way of life as the poor and entrepreneurs look for alternative means of survival, according to Reuters.",economy
"Forced evictions of Palestinian farmers from their land in the Jordan Valley and from the Hebron district """""" to make room for more settlements",palestine
"As more commerce moves online, encryption technology is not only securing the digital economy, it's helping to grow it, according to",economy
Changes are afoot that will help Japan boost its gross domestic product -- at least on paper -- by accounting for research and development,economy
President Barack Obama on Sunday announced plans to host the leaders of 10 Southeast Asian nations next year as he rejected accusations that Middle East turmoil was distracting him from focusing on Asia. ,obama
A GLASGOW pro-Palestine campaigner was detained at Tel Aviv Airport and held for more than 24 hours before being deported back to Britain. ,palestine
"QALQILYA, December 1, 2015 (WAFA) """""" Israeli army forces intentionally fired gas canisters in the direction of a Palestinian family's house, setting it on fire.",palestine
Some positive trends are that even the smallest new business or the smallest consumer can impact our food economy in a big way. By them,economy
"Further, Earnest argued Obama will spend the next year with &quot;a clear eyed assessment of his view of what's happening&quot; when it comes to",obama
"Israel is a small country with a thriving security startup industry, and Microsoft appears to be have a taste for them. Today it announced an",microsoft
"New Delhi, Feb 29 (IANS) Focusing on rural economy and infrastructure with minor rebate for small taxpayers but amnesty for defaulters, Finance Minister Arun Jaitley on Monday unveiled a Rs.19.78 lakh crore ($300 billion) budget for 2016-17, earmarking more money for health, literacy and roads. The direct impact on taxpayers from the proposals announced during the 100-minute budget speech will ",economy
"President Barack Obama lashed out Wednesday at Republicans who insist on barring Syrian refugees from entering the U.S., deeming their words offensive and insisting &quot;it needs to stop.&quot; &quot;Apparently they're scared of widows and orphans coming into the United States of America,&quot; Obama said. Mocking ",obama
"Tourism and public spending continued to boost the economy in January, in light of contraction in private consumption and exports, according to the Bank of Thailand data. ",economy
"The Belarusian government plans to step up its campaign against the shadow economy. In January 2016, new amendments to the Tax Code",economy
" When Microsoft first announced HoloLens, its mixed-reality hardware platform, many of us assumed it was little more than a cool demo that was meant to stir up excitement for the company. But it was clearly more than that and starting today, Microsoft will start taking pre-orders from developers who have applied for a unit. Developers who get an invite will be able to buy a unit for $3,000 ",microsoft
Microsoft's October launch event in New York delivered a fair few surprises for fans of the four-coloured flag. Whilst the fulcrum-flipping Surface,microsoft
"And if we want to go back to Iranian support to the Palestinian people, it goes back to the beginning of the Iranian Islamic Revolution in 1979,",palestine
"KOLKATA: After India's top mobile carriers, the Broadband India Forum (BIF) has trained its guns on Microsoft to counter the software goliath's",microsoft
Microsoft just inked a new deal with longtime rival Red Hat to support the company's version of Linux on Microsoft's cloud service Azure.,microsoft
"The investigation began with the ACSO, Anderson County District Attorney's office, Texas Rangers and Palestine Police detectives, according",palestine
"If a two-state solution fades away, Israel will consolidate apartheid across all of Palestine. ",palestine
"A new pledge asks digital economy companies to commit to creating &quot;good work.&quot; But what does that mean? Many workers who take jobs on &quot;gig economy&quot; platforms like Uber, Handy, Instacart, and Taskrabbit are independent contractors who aren't entitled to the same benefits, insurance, and other social programs as their on-staff peers. Requiring (or even allowing) platforms to provide this type of ",economy
"Microsoft released the Band a year or so ago, in its first effort to crack the wearable health-tech market. In short, it didn't. The first Band was",microsoft
"Lumia 550, Microsoft's affordable 4G LTE Lumia brand phone powered with Windows 10, is now available for pre-orders in the UK. While the Microsoft Store in the UK is yet to announce pre-orders, retailers have already started the process. Carphone Warehouse is charging £89.99 for a SIM-free Lumia 550. ",microsoft
Obama has made clear he isn't interested in debating or second guessing his ISIL strategy. He has refused providing the emotional response,obama
With all the reporting and commentary that faulted President Obama for not displaying more anger at his news conference Monday on the Paris,obama
"President Barack Obama on Friday condemned the attack on a hotel in Mali that killed at least 20 people, and said the bloody siege is a",obama
PARIS (AP) - The latest news from the U.N. climate conference that began Monday in Paris. All times local: 5:30 p.m.. Israel's prime minister and the Palestinian,palestine
"However, it's difficult to tell exactly what emotions Jones is experiencing from his expression, so one fan has enlisted the help of Microsoft's",microsoft
Conservatives today are incensed that President Obama didn't plunge America deeply into a needless war in Syria two years ago. They see a,obama
"US President Barack Obama voiced his determination to put Asia front and centre in his foreign policy Saturday, even as a two-nation visit to the region was eclipsed by jihadist attacks in France and Mali. ",obama
"President Barack Obama will recognize 17 people on Tuesday with the nation's highest civilian award, the Presidential Medal of Freedom.",obama
Microsoft has pledged to invest EUR 70 million in French start-ups over 3 years and to contribute EUR 13 million to the national school digital,microsoft
"The UK economy Gross Domestic Product (GDP) grew by 0.5% in the third quarter of 2015, the Office for National Statistics (ONS) has reported. In bad news for chancellor George Osborne, the economy could not continue its strong growth. The second quarter increase was a pleasant surprise for the UK, up from a 0.4% growth in the first quarter. ",economy
"Israeli right-wing activists prepare to prevent demolition of their synagogue. Above, activists wave Israel national flag during a rally outside",palestine
Israel has suspended contact with European Union bodies involved in the peace efforts with the Palestinians after the bloc began to require,palestine
"US President Barack Obama on Saturday condemned what he called the &quot;appalling&quot; jihadist attack in Mali that left at least 27 people dead, including an American citizen. &quot;This barbarity only stiffens our resolve to meet this challenge,&quot; he said during a visit to Malaysia, referring to the global threat of extremist violence. Gun-toting jihadists took more than 100 people hostage for around nine ",obama
"As someone with a fairly standard workout routine, I became accustomed to seeing certain data from my Microsoft Band during and after a",microsoft
"Barack Obama, who came into office in 2009 at the bright and sprightly age of 47, has been aging in front of our eyes. Over the past nearly",obama
"He just attacked baby boomers """"""and the way they've pillaged the U.S. economy,"""""" saying the 76 million people born between 1946 and 1964",economy
"Religious liberty is the most important freedom in the United States, Texas Republican Ted Cruz said Friday. """"""It is the first right protected in the",obama
President Barack Obama slammed US &quot;hysteria&quot; about the security risks posed by Syrian refugees Tuesday as Republicans took steps aimed at freezing White House programs to resettle them in the wake of the Paris attacks. The discovery of a Syrian passport near the body of one assailant in the Paris attacks that killed 129 people last Friday has stirred fears among US lawmakers and governors that ,obama
"WAFA reported on Palestinian locals as complaining that snipers occupied the rooftops of several high buildings, spreading panic among",palestine
"US President Barack Obama voiced his determination to put Asia front and centre in his foreign policy Saturday, even as a two-nation visit to the region was eclipsed by jihadist attacks in France and Mali. America's self-styled &quot;Pacific president&quot; has been frustrated to see a trip to Malaysia and the Philippines - designed to highlight his stated re-focus on Asia - overshadowed once again. ",obama
PALESTINE (KYTX)-A segment on the Palestine mayor's radio talk show is causing controversy across town. Mayor Bob Herrington hosts a,palestine
"KUALA LUMPUR, Malaysia """""" President Obama once professed that he was not comfortable with the theater of the presidency. But on his",obama
"FORT WAYNE, Ind. (21Alive) - The fifth-ranked Panthers (13-1) built a 28-point lead on No. 1 New Palestine, saw the Dragons storm back to take the lead twice in the fourth quarter, and then responded with a 68-yard touchdown drive in the final minute to pull out a 64-61 win in the highest-scoring final in Indiana history. ",palestine
"IMEMC News: The Palestinian Health Ministry has reported that the number of Palestinians killed by Israeli fire since October 1 has reached 91,",palestine
"&quot;Let's not forget, 59 percent of Americans today believe that Barack Obama is still a Muslim,&quot; said Arsalan Iftikhar, an author, lawyer and",obama
"The 18-year-old, identified as Ezra Schwartz from Massachusetts, was spending his gap year in Israel when he was shot and killed in a shooting near the West Bank settlement of Alon Shvut in the Etziodn Bloc. According to the Times of Israel, Shwartz and a Palestinian man were declared dead at the scene in the incident that killed three total and injured four others. Schwartz, a recent graduate ",palestine
The Obama administration is moving quickly to try and get the case before the high court. The petition was filed just over a week after a federal,obama
"The Emergency Bureau for the FIFA World Cup Qualifiers, composed of chairman Shk. Salman Bin Ebrahima Al Khalifa (Bahrain), deputy",palestine
"Twenty-three percent believe President Obama has a clear plan to deal with the Islamic State, the lowest percentage recorded in the duration of",obama
"Next, Microsoft CEO Satya Nadella thinks it will be the &quot;agent,&quot; the sort of virtual assistant like his company's Cortana that controls the apps on our phone or",microsoft
"BEIJING""""""The two tracks of the Chinese economy moved further apart in October as the nation's once-mighty industrial sector slowed while",economy
"WASHINGTON """""" When President Obama first won the White House, he recruited Ray LaHood, a Republican congressman, to join his cabinet.",obama
Israel says it's suspending contacts with European Union bodies involved in peace efforts with the Palestinians. This comes after the bloc,palestine
"MANILA, Philippines (AP) — President Barack Obama vowed Thursday to work &quot;meticulously&quot; with Congress to try to close the Guantanamo Bay detention center, and said he saw no reason for the Paris attacks to derail his long-planned push to make good on an unfulfilled campaign promise. ",obama
"NABLUS, November 24, 2015 (WAFA) """""" The 'Al-Quds Index' of the Palestine Exchange closed Tuesday's trading at 515.11 points, up by 3.96 points (0.77%)",palestine
"With the upcoming headset, the company hopes to avoid the small thinking and corporate infighting that ultimately doomed its predecessor. ",microsoft
"Microsoft has recently unleashed the Surface Pro 4 , which the company describes as a professional hybrid tablet for those looking for &quot;more than just a laptop.&quot; ",microsoft
"Latest developments in the state of our economy, as reported by the Monetary Policy Committee (MPC) of the Central Bank of The Gambia,",economy
"LONDON -- How does the CEO of one of the world biggest technology companies spend his week? The somewhat mundane answer, if a presentation by Microsoft chief Satya Nadella is anything to go by, is mostly in meetings, dealing with email and working late into the night. ",microsoft
"According to experts with the Indiana University Kelley School of Business, there's plenty about state and local economies to inspire optimism.",economy
"So I've been using this Microsoft Surface Pro 4 for just over a week so far, and I'm mostly in ",microsoft
"WASHINGTON """""" President Obama said Sunday he has told top military officials to &quot;get to the bottom&quot; of reports that intelligence assessments",obama
 Liverpool Cathedral and abstained in the Synod vote to endorse the EAPPI (Ecumenical Accompaniment Programme in Palestine and Israel),palestine
"Meanwhile, Israeli soldiers detained a Palestinian minor, unidentified yet, as he attempted to cross through an Israeli-controlled checkpoint",palestine
"Microsoft has targeted its smartphones toward emerging markets, which are expected to witness substantial growth in smartphone adoption. ",microsoft
"Jed Kleckner, Delivery.com's chief executive officer, and Ben Lerer, Thrillist Media Group's co-founder, discuss the on-demand economy with",economy
"The Israeli-Palestinian could be solved either through a two-state solution or a """"""confederation,"""""" a top European Union official said last week,",palestine
"Johannesburg - The South African economy is showing signs of health, despite declining, according to the BankservAfrica Economic",economy
"A sharp slowdown in world trade threatens to put the global economy at risk, the Organisation for Economic Co-operation and Development",economy
"Microsoft is considering advancing the blocking of the SHA-1 hashing algorithm on Windows to as early as June next year, taking a cue from a",microsoft
Venturebeat reports that Microsoft Corporation introduced a new facial recognition feature that will rate user's facial hair. The tool is available,microsoft
"Such a a solution is impossible, he said, &quot;mainly because - as far as I understand Islam, as far as I understand the Palestinian movement - the",palestine
"U.S. President Barack Obama takes part in the APEC CEO Summit in Manila, Philippines, November 18, 2015. REUTERS/Jonathan Ernst.",obama
US President Obama has called for resolve in the face of terrorist threats. UN Secretary-General Ban Ki-moon has urged the United States and,obama
"At a time when many companies are expanding cloud storage options, Microsoft Corp. is shrinking its offerings. ",microsoft
"''The government's plans to encourage a more balanced economy are clearly right, but need to be accompanied by far more action.",economy
The American Anthropological Association's (AAA) annual business meeting voted on 20 November 2015 to send a resolution to endorse the,palestine
World stock markets drifted lower Tuesday after a pessimistic forecast for the world economy added to jitters that stem from the Federal Reserve's rate hike plans. KEEPING SCORE: Germany's DAX was down ,economy
Boris Johnson's Palestine visit fell apart after organisers cancelled meetings and accused him of adopting a &quot;misinformed and disrespectful&quot; pro-Israel stance. ,palestine
"With its growing emphasis on business-intelligence and analytics, Microsoft has a lot of different reporting options. It wasn't until I read a SQL",microsoft
