text,label
"SINGAPORE - Singapore's export-oriented economy has been hit by the slowdown in China and beyond, which has also put pressure on key sectors such as marine oil and gas, commodity trading and banks. Last year, the economy grew at just 2 per cent, its slowest ",economy
"President Obama made the comparison when responding to this question: """"""Was there a point in those first three years where you started to feel",obama
"Joseph Stiglitz, Nobel Prize-winning economist, Columbia University professor and chief economist for the Roosevelt Institute. His new book is",economy
"KUALA LUMPUR, Malaysia (CNN) """""" President Barack Obama made another emotional case Saturday for welcoming migrants, who are",obama
"Palestinian suffering is longstanding - since losing 78% of their nation in 1948, the rest in June 1967, suffering horrifically under Israel's",palestine
"Harris outlined five reasons why """"""Fedexodus,"""""" the initial normalization of monetary policy, won't have a crippling effect on real economic activity",economy
"Fernando Alonso has been driving in &quot; economy mode&quot; this year to save energy for a serious bid for success in 2016, the McLaren driver said on Thursday. Alonso told reporters preparing ahead of Sunday's Brazilian Grand Prix that he felt he had underperformed in his first – hugely disappointing – season back at McLaren during which Honda has suffered agonizing failures with engines. The two-time ",economy
Apple's iPad Pro and Microsoft's Surface Pro 4 are currently the two premium hybrids available in the market today. Both can be used as a,microsoft
Property magnate Donald Trump said Thursday that he would be excited to make a &quot;deal&quot; to end the ,palestine
An East Texas man says there are too many homeless families in need in Palestine.  ,palestine
"Last week the Obama administration came up with a kinder, gentler way of waging war. It gave Islamic State militants a 45-minute warning that",obama
"Developers can now pre-order the Microsoft HoloLens Development Edition from the company for a cool $3,000. The first development kits will ship on March 30. The availability announcement arrives as a surprise just one day after HTC opened pre-orders for the Vive. Unlike HTC and Oculus, Microsoft didn’t leak its pre-order availability date early. Also unlike Oculus, and to a lesser extent HTC ",microsoft
"The House of Representatives Thursday defied President Obama's threat of a veto and voted, 289-137, to impose new screening requirements",obama
"Costing $200 more than the most basic Surface laptop, this model features an Nvidia GeForce graphics chip rather than relying on graphics tech built into the main processor. ",microsoft
"As the two correctly note, the AFSC has worked in Israel and Palestine since 1948 when we provided assistance to Palestinian refugees in",palestine
"Washington (CNN) Rick Santorum hammered Barack Obama's foreign policy on Saturday, blaming the President for the terror attacks in Paris",obama
"One of 2015's most talked-about books on the Middle East is Padraig O'Malley's """"""The Two-State Delusion: Israel and Palestine """""" a Tale of Two",palestine
"Students for Justice in Palestine at U. of Denver defend actions on Facebook, denies being hypocritical. By Times of Israel staff November 27,",palestine
"This week, President Obama lambasted Sen. Ted Cruz for absurdly suggesting that Muslim refugees from Syria be barred from entering the",obama
"It’s fair to say that Microsoft Office is very different today from what it once was. And with its drive toward subscription-based software, perhaps Microsoft feels that it needs a new set of hands on the reins, as rumors abound that it may be set to appoint current CXO (that’s Chief Experience Officer) Julie Larson-Green as the new head of the enterprise software. As with all rumors, this one ",microsoft
"In its most recent quarter Microsoft Corporation had actual sales of $ 20379M. Among the 9 analysts who were surveyed, the consensus",microsoft
"The Israeli move comes amidst escalating tension in occupied Palestine, and a large number of videos, including those showing Israeli soldiers",palestine
"The GOP presidential candidate took his stance on Syrian refugees, urging President Obama to """"""take the pause"""""" or else """"""it would be a big",obama
"As president, my top priority is to grow our economy and strengthen the middle class. When I took office, America was in the middle of the worst",economy
The annual Palestine Christmas Parade will be at 2 p.m. Dec. 6. All entrants are asked to register by Nov. 26. Contact Cynthia and Scott at,palestine
US President Barack Obama on Sunday (November 22) said the United States and its allies would not relent in its fight to combat Islamic State,obama
New information has been released about a robbery seen from Dallas to Arkansas.  New footage from Palestine’s prosperity Bank shows a large forklift ripping out the ATM from a drive-thru lane.  ,palestine
"Greece's state statistics agency on Friday said the economy contracted by 0.5 percent in the third quarter, when its EU partners threatened to throw the country out of the eurozone. The data is consistent with European Commission forecasts that Greece will fall back into recession in 2015 after a brief respite last year. ",economy
"In Occupied Palestine, however, the expression is perceived quite differently, because the Israeli police there have nothing whatever to do with",palestine
"Malaysia will write to FIFA for a third time asking for their World Cup qualifier away to Palestine next week be moved to a neutral venue, local media reported on Tuesday. Malaysia said the Nov. 12 fixture at the Dora Stadium in Hebron should not go ahead because of security concerns after a month-long wave of violence in the West Bank. &quot;We are aware of the situation and will write to FIFA to ",palestine
"US Secretary of State John Kerry is scheduled to visit Israeli and Palestinian leaders next week in a bid to halt ongoing violence, but a senior",palestine
"Microsoft’s revenues and non-GAAP (generally accepted accounting principles) earnings per share, were $21.7 billion and $0.67 per share, respectively. ",microsoft
"WASHINGTON (AP) — The Obama administration is assuring the nation's governors that refugees who come to the U.S. undergo a &quot;rigorous security vetting process,&quot; particularly if they are fleeing from Syria. ",obama
" 2015 (WAFA) """""" A slight rise in temperature is expected on Tuesday, yet remaining relatively cold, according to the Palestinian Meteorological",palestine
"It's not really Microsoft's fault. PowerPoint gives you all kinds of templates and graphics tools, but all anyone ever uses is boring bullet points on a white",microsoft
Microsoft crushed the Zacks Consensus Estimate and the strength across most businesses sent shares soaring. ,microsoft
"This past Friday, the American Anthropological Association, with more than 10,000 members, became the largest U.S. academic organization",palestine
"Microsoft Lumia 950 XL is Redmond's new flagship device that's expected to debut later this month in several markets across the world, but",microsoft
WASHINGTON (Reuters) - A U.S. appeals court on Thursday allowed three undocumented immigrant women in Texas to join the Obama,obama
"Find out what Johnson is doing at Microsoft to improve the user experience by forging relationships with brands such as Uber and Dropbox,",microsoft
"Specifically, that they'd be reassigned to work on Microsoft Dogs, an obscure 1995 CD-ROM the company made to inform dog owners of the",microsoft
"Violence, Moral Equivalence, and the End of a Two-State Solution in Israel-Palestine. A slanderous ad in The New York Times accusing John",palestine
"The eurozone economy slowed in the three months to September as exports to large developing economies weakened, a development that",economy
"PLYMOUTH'S Sutton Harbour generates """"28million a year for the city economy, a new report says. Marine related businesses in and around",economy
"The team behind Microsoft's Project Oxford""""""an initiative that aims to arm developers with easy-to-use machine learning tools that'll enable",microsoft
What can massive data mining of global news coverage tell us about the economic sanctions against Russia or global reaction to China's,economy
"Microsoft last week announced measures to improve security management and transparency for Azure cloud services and Office 365. The features, which come from technology Microsoft acquired last year when it purchased Adallom, will bolster security in cloud apps such as Office 365, Box, Salesforce, ServiceNow and Ariba. The reinforcements are the first of a series of planned measures. ",microsoft
"Thirty years after the UN partition plan of Palestine, the General Assembly passed a new resolution proclaiming an annual observation,",palestine
The civil society groups which met United States President Barack Obama today were told that while the US recognised the violations of human,obama
Rush Limbaugh tells FNC's Chris Wallace that the president spends more effort fighting concervatives than he does ISIS: &quot;Barack Obama's No.,obama
"&quot;Bigger models tend to generate better accuracies in various applications,&quot; Microsoft writes in its introduction to the framework. &quot;However, it remains a challenge for common machine learning researchers and practitioners to learn big models.&quot; ",microsoft
"Microsoft's investment in the technology doesn't stop with the hardware and software itself, however. As the company announced on the",microsoft
Obama offered the condolences of the American people to the people of Mali and families of the 20 people killed in Friday's attack in Bamako. ,obama
"Chuka Umunna, who told manufacturing bosses the Department for Business, Innovation and Skills should be the engine room of the economy.",economy
Some models of Microsoft's new Surface Book sold out immediately. Here's an update on the availability and wait times for all models.,microsoft
"FILE - This Monday, Aug. 24, 2015, file photo, shows the New York Stock Exchange. Global stocks were weighed down Monday, Nov. 9, 2015",economy
"Egyptian President Abdel Fattah al-Sisi (R) meets with Palestinian President Mahmoud Abbas in Cairo, January 14, 2015. Photo: Reuters.",palestine
"PALESTINE (KYTX) - During a recent investigation into a possible sexual assault of a child, Palestine Police Officers arrested four people due to possible Tampering with Physical Evidence. ",palestine
"Today Microsoft HoloLens was released for purchase - sort of - for developers, in a kit that's made strictly for those that plan on making software for the device. This version of Microsoft HoloLens is not meant to compete with the other virtual reality headsets being revealed and/or released in the next several weeks. The Oculus Rift, for example, has … Continue reading ",microsoft
BERLIN (AP) — Microsoft says it will use data centers inside Germany to store German customers' data amid ongoing concerns over privacy. ,microsoft
I will stick my neck out into the contrarian trade and that would be financials and economy-linked sectors because what I am seeing is that the,economy
"China is delaying plans to loosen controls on the economy amid the country's slowdown. Above, an investor stands in front of an electronic",economy
" Microsoft released Office 2016 to the general public back in September, and it’s a good update overall . But if you’d like to help improve future releases of Office, you’ll want to check out the new Office Insider program . Office Insider clearly draws inspiration from Microsoft’s Windows Insider user-testing program, as Neowin points out . And just like how Windows Insider lets you see what’s ",microsoft
Palestinian activist Nimala Kharouseh has spent a week in Newcastle meeting community groups and giving an insight into the occupied,palestine
Boris Johnson's Palestine visit fell apart after organisers cancelled meetings and accused him of adopting a &quot;misinformed and disrespectful&quot; pro-Israel stance. ,palestine
This third party report found that granting China market economy status is and NAFTA economic welfare to decrease by $42.5- $68.5 billion.,economy
"China’s worsening economy faces an exodus of capital that will drag the yuan lower regardless of whether or not the International Monetary Fund grants the currency reserve status at a coming review, according to Daiwa Capital Markets. ",economy
"Boston University’s Students for Justice in Palestine held a die-in protest at Marsh Plaza Thursday in […] The post Palestinian advocacy group stages die-in, faces opposition from Israel activists appeared first on The Daily Free Press . ",palestine
"Obama says sending troops into Syria to fight ISIS would be a &quot;mistake,&quot; but not allowing Syrian refugees into the U.S. would betray American values. ",obama
"FXStreet (Delhi) - Michael Every, Research Analyst at Rabobank, suggests that the recent economic releases from the mainland suggests that",economy
"KUALA LUMPUR, Nov 12 (Bernama) -- Palestine whipped Malaysia 6-0 in the 2018 World Cup/2019 Asian Cup Group A qualifying match at the Amman International Stadium in Jordan today. ",palestine
"President Obama, like so many of us, was caught unprepared for ISIS's devastating attack on Paris. But unlike the rest of us, the leader of the",obama
On Nov. 29 cities across the world mark the day of International Solidarity with the Palestinian people created by the United Nations. For years,palestine
" Microsoft is to open its first two data centres in the U.K. as part of the company’s growing network of data centers outside of the U.S. The announcement means that Microsoft will be able to bid for U.K. and local government cloud computing contracts in the future. Locating the Azure data centers in the U.K. will also speed up services for U.K. and European clients, said CEO Satya Nadella at the ",microsoft
"As the only Palestinian club on campus, Voices for Palestine has ground to cover in the conversation on diversity and social justice. Its primary",palestine
"Apple chief Tim Cook has been in Dublin to collect a gold medal award as honorary patron of the Trinity College Philosophical Society, but he",microsoft
"Ljubljana, 23 November - The Cultural Embassy of Palestine will be launched in Ljubljana on Monday, a week of events that aims to promote debate on the role",palestine
"If you're a Windows 7 or 8 user who's been surprised to find Windows 10 automatically installing on your machine, you aren't alone: just a few",microsoft
"Why are middle-aged Americans dying? This is a question that throws into sharp relief the purpose of economic policy, and the shadows that it",economy
Microsoft's new plan to keep the US government's hands off its customers' data: Germany will be a safe harbor in the digital privacy storm.,microsoft
"In a reorganization of its legal department, Microsoft named longtime company lawyer Horacio Gutierrez as the company’s general counsel, replacing Brad Smith. ",microsoft
U.S. President Barack Obama’s meeting Friday with Malaysian Prime Minister Najib Razak stands out on a long list of his one-on-one talks with world leaders this week because the premier is under fire over a multi-million dollar funding scandal. ,obama
You really can't accuse Microsoft of phoning it in when it built the original Band. Between jamming 10 different sensors into a glorified wristband,microsoft
President Barack Obama says Russia's airstrikes against moderate opposition groups in Syria are bolstering the regime of Syrian President Bashar Assad. He's calling on Russia to play a more constructive role by shifting the focus of its airstrikes to defeating the Islamic State. Obama spoke at ,obama
"Microsoft Garage is a place where ideas come to reality. And these are not just ideas, but it's a stuff that no would ever think about.",microsoft
"Is the ABC's Middle East correspondent, Sophie McNeill, too biased in favour of the Palestinians? Eric Abetz thinks so -- but Mark Scott has defended her reporting. Read more on the blog ",palestine
"But he's been a prolific presence on social media, where he acknowledges no one fully understands the economy, defends Ben Bernanke and",economy
The White House was on the defense Wednesday morning for statements made by President Obama -- who labeled Friday's Paris massacre,obama
"Microsoft is partnering with Intel, HP, Dell, and Lenovo in a big marketing push to get consumers to buy new PCs with Windows 10. All five",microsoft
"The Obama administration on Friday asked the U.S. Supreme Court to revive President Barack Obama's executive action to protect millions of illegal immigrants from deportation, saying Republican-led states had no legal basis to challenge it. ",obama
Paswan said the recent State visit by Indian President Pranab Mukerjee to Palestine reinforced India's strong commitment to the Palestinian cause. ,palestine
"On November 4, 2015, Scott Guthrie, Executive Vice President, Cloud and Enterprise Group, Microsoft, announced that Microsoft and Red Hat",microsoft
U.S. President Barack Obama says he will &quot;definitely&quot; raise issues of human rights and corruption when he meets Malaysian Prime Minister Najib Razak in Kuala Lumpur on Friday. ,obama
"(JTA) """""" Pro-Palestinian groups participating in a student protest against tuition increases at the City University of New York are blaming the",palestine
Microsoft last month announced the Surface Pro 4 among a range of other Microsoft says the device is 50 percent faster than a MacBook Air,microsoft
"President Obama has proclaimed that ISIS """"""cannot strike a mortal As for Obama's talk about """"""fantasy,"""""" it is not ISIS that's stuck in a fantasy.",obama
"Microsoft is building data centres in Germany that the US government can't touch. MS will build data centres, then hand the keys over to a local",microsoft
"The newly open sourced Distributed Machine Learning Toolkit features fast, parallelized, and easy-to-deploy machine learning algorithms ",microsoft
"NEW PALESTINE """""" Joe Izbicki will be playing for more than just a second-straight state championship. The Dragons senior middle linebacker",palestine
"Next week, President Obama will fly to Paris for the U.N. Climate Change Conference, a meeting to work out a global agreement to reduce climate pollution.",obama
"RUSK """""" Destiny Mathews and Jaila Cook scored 16 points apiece as the Palestine girls basketball team cruised past Rusk 52-29 in a",palestine
"KUALA LUMPUR, Malaysia (AP) — President Barack Obama vowed Sunday that the United States and its international partners &quot;will not relent&quot; in the fight against the Islamic State group, insisting the world would not accept the extremists' attacks on civilians in Paris and elsewhere as the &quot;new normal.&quot; ",obama
U.S. President Barack Obama holds a news conference at the conclusion of his ASEAN Summit and East Asia Summit meetings in Kuala,obama
Open-source devops platform Cloud Foundry has opened for business on Microsoft's cloud. Cloud Foundry hit general availability on Azure on,microsoft
The Federal Reserve attempted to &quot;pump up&quot; the stock market to create a wealth effect that would stimulate consumer spending and get the,economy
Palestine held its first town hall meeting Thursday night. About nine Palestine city leaders were at the meeting to answer questions. They covered a range of topics from creating new sidewalks to crime prevention tips. ,palestine
"Malaysia will proceed to play next week's World Cup qualifier in Palestine but have the option to withdraw upto 24 hours before arriving in Hebron if safety becomes an issue, the country's sports minister said on Wednesday. Malaysia had written to FIFA three times to request the Nov. 12 Group A match be moved to a neutral venue after a month of violence in the Palestinian territories but ",palestine
Greenhill &amp; Co. CEO Scott Bok discusses European Central Bank president Mario Draghi's plans to boost stimulus program. He speaks on,economy
"Microsoft's video games console, the Xbox One, has removed the ability to control the device using hand gestures. ",microsoft
Technically Incorrect: A new series of commercials depicts Macs as simply inferior when it comes to being productive. ,microsoft
"Mauled economy seeks a way out. 13 Nov 2015 00:00 Lisa Steyn. Everything seems stacked against South Africa, and the Reserve Bank decides on interest",economy
"By Roya Fathalizadeh– On Nov. 7, friends and families gathered together to celebrate Palestinian culture. University of Louisville’s third annual, Night for Palestine exemplified the country’s art, music, food and dance, showing off its assorted traditions in aims of educating people of their culture along with raising money and awareness for the Olive Tree Campaign. This organization […] ",palestine
"President Barack Obama has turned to senior adviser Brian Deese, an economic expert who previously led the administration's climate change efforts, to head a team formed to pick a Supreme Court nominee and win confirmation, the White House said. ",obama
"PALESTINE, Texas (AP) &quot; The lone survivor of an attack that left six dead at an East Texas campsite has told authorities that the suspect had drinks with the blended family before suddenly producing a gun and firing on them. ",palestine
" Microsoft's Windows 10 Lumia 950 and Lumia 950 XL smartphones are available for pre-orders in the UK. Carphone Warehouse is offering the best price so far for a Sim-free Lumia 950, asking £419.99 and £469.99, for the larger screened XL, whereas other retailers have priced it at slightly over £500. You can also choose to pre-order the phone on contracts with EE, Vodafone, iD and O2 from Carphone ",microsoft
Why is this crucial for the country ' s growth prospects and how will it affect the overall economy ? How will this affect your development plan in,economy
Lync Room Systems will become Skype Room Systems tomorrow via a software update issued by Microsoft. Lync Room Systems are,microsoft
"Tell me: What's a suicide bomber doing with a passport? He's not going anywhere. And, though I'm not a religious scholar, I doubt that a",obama
Kuala Lumpur: US President Barack Obama said Russia must make a strategic decision about Syria and the next several weeks will show,obama
Microsoft chief executive Satya Nadella and BBC director-general Tony Hall said they found it &quot;inspiring&quot; to meet school children using microcomputers due to be rolled out to every Year 7 pupil in the UK. ,microsoft
"Growth in the 19-nation eurozone slowed to 0.3 percent in the third quarter, official data showed on Friday, with the economy in powerhouse Germany cooling as France returned to expansion. The quarterly growth was below the analyst estimate of 0.4 percent for the period and will fuel speculation the European Central Bank will expand its vast stimulus programme next month. The Eurostat agency ",economy
It's been a little over a month since Microsoft officially introduced the world to the Lumia 950 and Lumia 950 XL. As Microsoft preps a global,microsoft
"There is room for Chinese authorities to deploy fiscal and monetary stimulus if the world's second-largest economy slows further, Nakao told a lecture. ",economy
"On this day in 1947, the United Nations General Assembly voted to partition Palestine between two newly created Arab and Jewish states while",palestine
PARIS: France's economy minister Emmanuel Macron said on Tuesday that his country's economy is &quot;lacklustre&quot; and will probably remain so in,economy
His comments were part of an ongoing effort by the Obama administration to address concerns about the safety of taking in refugees from Syria.,obama
"When President Obama boarded Air Force One for a 10-day, three-country tour just hours after a small group of gunmen and suicide bombers",obama
"BBRUSSELS, November 28, 2015 (WAFA) – On the occasion of the International Day of solidarity with the Palestinian People, a European Union’s official Friday called for placing Palestine and the Palestinian people under international protection. ",palestine
"During the riots of 1929 when Palestinian Muslims attacked the Jews of Hebron, my grandfather hid his Jewish neighbours in his home, protecting them from the massacre. Since the days of my grandfather, Palestine has changed. Palestine is a young society, 35% of us are between 15 and 30 years of age, and another 40% are under 14. ",palestine
"Apple's EPS is consistently strong, while Microsoft is less predictable ",microsoft
Sen. Ted Cruz (R-Texas) responded to President Barack Obama a day after he took a not-so-subtle swipe at the Republican presidential,obama
"Joe Biden may have decided to stay out of the 2016 presidential race, but President Obama has jumped in. He can't help himself. He has the",obama
"In the coming six months, there seems to be growing optimism in terms of the economic performance with 80 per cent respondents feeling that the state of the Indian economy would be better, says Survey ",economy
President Obama has spent the last seven years trying to avoid the world as it is. He has put his intellect and rhetorical skills into the,obama
"According to the IMF and World Bank, the once booming economy that grew 9.2 percent in 2010 is now forecast to grow by just 3 percent this",economy
"Despite spending billions to acquire Nokia's handset business, Microsoft (NASDAQ:MSFT) hasn't been able to drive interest in its mobile",microsoft
" the iPad Pro has noticeably less lag time than Microsoft's rival. the Apple Pencil is supposed to have less latency than the Microsoft Pen,",microsoft
